{
  "schema_version": "1.0.0",
  "generated_at": "2026-10-27T10:37:33.101Z",
  "map_geometry_url": "/data/v1/territory/regions.geojson",
  "units": {
    "area_km2": "square_kilometres_from_administrative_geometry",
    "occupied_km2": "square_kilometres_from_geometric_overlap",
    "free_km2": "square_kilometres_from_administrative_geometry",
    "occupied_share_pct": "percent_of_region_geometry",
    "free_share_pct": "percent_of_region_geometry"
  },
  "sources": [
    {
      "name": "Ukraine Common Operational Dataset administrative boundaries",
      "url": "https://data.humdata.org/dataset/cod-ab-ukr",
      "role": "2022 ADM1 land boundaries distributed through geoBoundaries gbHumanitarian"
    },
    {
      "name": "DeepStateMap public history",
      "url": "https://deepstatemap.live/",
      "role": "Dated Russian-occupied geometry and the separate prewar Crimea/Donbas footprint"
    },
    {
      "name": "Conflict Investigations NZZ Maps territory series",
      "url": "https://github.com/conflict-investigations/nzz-maps",
      "role": "Latest national occupied-area observation at or before each map date"
    }
  ],
  "methodology": "The 2022-02-23 baseline uses the static prewar Crimea/Donbas footprint. Each actual archived DeepState date uses the union of that footprint and its Russian-occupied Polygon/MultiPolygon geometry, including nested GeometryCollections. Transnistria is excluded and its footprint subtracted before intersecting the union with each OCHA/geoBoundaries ADM1 polygon. Turf calculates geodesic overlap areas, capped to each region area for numeric precision; overlapping polygons count only once. All 27 regions use the same static administrative geometry. National summaries retain the independent NZZ observation at or before the map date and its reported_national_date; all reported national values are null if no prior observation exists. Only archive dates and the explicit baseline are published, without interpolation.",
  "limitation": "Regional values are map-derived geometric estimates, not surveyed cadastral areas. Archive gaps are real and do not locate the exact day of a control change. The prewar footprint is retained in every frame. Regional values can differ from the independently modeled national occupied-area series because boundaries, dates, and methodology differ; the NZZ observation date may precede the map date.",
  "license_notice": "Administrative boundaries are CC BY 3.0 IGO. Other upstream sources retain their own rights and terms; preserve source attribution and observation dates.",
  "dataset": "territory_region_control",
  "coverage_start": "2026-10-21",
  "coverage_end": "2026-10-21",
  "record_count": 27,
  "summary": {
    "official_ukraine_area_km2": 603550,
    "reported_national_date": "2026-09-02",
    "reported_national_occupied_km2": 101011.5,
    "reported_national_free_km2": 502538.5,
    "reported_national_occupied_share_pct": 16.7,
    "geometry_area_km2": 598023.7,
    "geometry_occupied_km2": 114234.3
  },
  "regions": [
    {
      "region_id": "UA-05",
      "name": "Vinnytsia Oblast",
      "short_name": "Vinnytsia",
      "source_name": "Vinnytska",
      "source_shape_id": "82583831B61774372920199",
      "area_km2": 26409,
      "occupied_km2": 0,
      "free_km2": 26409,
      "occupied_share_pct": 0,
      "free_share_pct": 100,
      "status": "free"
    },
    {
      "region_id": "UA-07",
      "name": "Volyn Oblast",
      "short_name": "Volyn",
      "source_name": "Volynska",
      "source_shape_id": "82583831B8521204452203",
      "area_km2": 20074.5,
      "occupied_km2": 0,
      "free_km2": 20074.5,
      "occupied_share_pct": 0,
      "free_share_pct": 100,
      "status": "free"
    },
    {
      "region_id": "UA-09",
      "name": "Luhansk Oblast",
      "short_name": "Luhansk",
      "source_name": "Luhanska",
      "source_shape_id": "82583831B54873972991132",
      "area_km2": 26603.8,
      "occupied_km2": 26497.8,
      "free_km2": 106,
      "occupied_share_pct": 99.6,
      "free_share_pct": 0.4,
      "status": "occupied"
    },
    {
      "region_id": "UA-12",
      "name": "Dnipropetrovsk Oblast",
      "short_name": "Dnipropetrovsk",
      "source_name": "Dnipropetrovska",
      "source_shape_id": "82583831B96004676694065",
      "area_km2": 31816.8,
      "occupied_km2": 36.6,
      "free_km2": 31780.3,
      "occupied_share_pct": 0.1,
      "free_share_pct": 99.9,
      "status": "partially_occupied"
    },
    {
      "region_id": "UA-14",
      "name": "Donetsk Oblast",
      "short_name": "Donetsk",
      "source_name": "Donetska",
      "source_shape_id": "82583831B94142902726322",
      "area_km2": 26421.7,
      "occupied_km2": 21207.7,
      "free_km2": 5214,
      "occupied_share_pct": 80.3,
      "free_share_pct": 19.7,
      "status": "partially_occupied"
    },
    {
      "region_id": "UA-18",
      "name": "Zhytomyr Oblast",
      "short_name": "Zhytomyr",
      "source_name": "Zhytomyrska",
      "source_shape_id": "82583831B9589848299664",
      "area_km2": 29733.1,
      "occupied_km2": 0,
      "free_km2": 29733.1,
      "occupied_share_pct": 0,
      "free_share_pct": 100,
      "status": "free"
    },
    {
      "region_id": "UA-21",
      "name": "Zakarpattia Oblast",
      "short_name": "Zakarpattia",
      "source_name": "Zakarpatska",
      "source_shape_id": "82583831B18144742655321",
      "area_km2": 12720.6,
      "occupied_km2": 0,
      "free_km2": 12720.6,
      "occupied_share_pct": 0,
      "free_share_pct": 100,
      "status": "free"
    },
    {
      "region_id": "UA-23",
      "name": "Zaporizhzhia Oblast",
      "short_name": "Zaporizhzhia",
      "source_name": "Zaporizka",
      "source_shape_id": "82583831B76074153455964",
      "area_km2": 27107.4,
      "occupied_km2": 20425.3,
      "free_km2": 6682.1,
      "occupied_share_pct": 75.3,
      "free_share_pct": 24.7,
      "status": "partially_occupied"
    },
    {
      "region_id": "UA-26",
      "name": "Ivano-Frankivsk Oblast",
      "short_name": "Ivano-Frankivsk",
      "source_name": "Ivano-Frankivska",
      "source_shape_id": "82583831B79719181911578",
      "area_km2": 13889.4,
      "occupied_km2": 0,
      "free_km2": 13889.4,
      "occupied_share_pct": 0,
      "free_share_pct": 100,
      "status": "free"
    },
    {
      "region_id": "UA-30",
      "name": "Kyiv City",
      "short_name": "Kyiv",
      "source_name": "Kyivska",
      "source_shape_id": "82583831B38424722393808",
      "area_km2": 831.8,
      "occupied_km2": 0,
      "free_km2": 831.8,
      "occupied_share_pct": 0,
      "free_share_pct": 100,
      "status": "free"
    },
    {
      "region_id": "UA-32",
      "name": "Kyiv Oblast",
      "short_name": "Kyiv Oblast",
      "source_name": "Kyivska",
      "source_shape_id": "82583831B27908373306414",
      "area_km2": 28032.4,
      "occupied_km2": 0,
      "free_km2": 28032.4,
      "occupied_share_pct": 0,
      "free_share_pct": 100,
      "status": "free"
    },
    {
      "region_id": "UA-35",
      "name": "Kirovohrad Oblast",
      "short_name": "Kirovohrad",
      "source_name": "Kirovohradska",
      "source_shape_id": "82583831B10116413873639",
      "area_km2": 24503.8,
      "occupied_km2": 0,
      "free_km2": 24503.8,
      "occupied_share_pct": 0,
      "free_share_pct": 100,
      "status": "free"
    },
    {
      "region_id": "UA-40",
      "name": "Sevastopol",
      "short_name": "Sevastopol",
      "source_name": "Sevastopilska",
      "source_shape_id": "82583831B98131377155256",
      "area_km2": 57.4,
      "occupied_km2": 57.4,
      "free_km2": 0,
      "occupied_share_pct": 100,
      "free_share_pct": 0,
      "status": "occupied"
    },
    {
      "region_id": "UA-43",
      "name": "Autonomous Republic of Crimea",
      "short_name": "Crimea",
      "source_name": "Avtonomna Respublika Krym",
      "source_shape_id": "82583831B17032883652392",
      "area_km2": 25510.4,
      "occupied_km2": 25510.2,
      "free_km2": 0.1,
      "occupied_share_pct": 100,
      "free_share_pct": 0,
      "status": "occupied"
    },
    {
      "region_id": "UA-46",
      "name": "Lviv Oblast",
      "short_name": "Lviv",
      "source_name": "Lvivska",
      "source_shape_id": "82583831B29518876663819",
      "area_km2": 21752.2,
      "occupied_km2": 0,
      "free_km2": 21752.2,
      "occupied_share_pct": 0,
      "free_share_pct": 100,
      "status": "free"
    },
    {
      "region_id": "UA-48",
      "name": "Mykolaiv Oblast",
      "short_name": "Mykolaiv",
      "source_name": "Mykolaivska",
      "source_shape_id": "82583831B18817350158740",
      "area_km2": 23950.1,
      "occupied_km2": 127.1,
      "free_km2": 23823,
      "occupied_share_pct": 0.5,
      "free_share_pct": 99.5,
      "status": "partially_occupied"
    },
    {
      "region_id": "UA-51",
      "name": "Odesa Oblast",
      "short_name": "Odesa",
      "source_name": "Odeska",
      "source_shape_id": "82583831B78920109116756",
      "area_km2": 33258.4,
      "occupied_km2": 0,
      "free_km2": 33258.4,
      "occupied_share_pct": 0,
      "free_share_pct": 100,
      "status": "free"
    },
    {
      "region_id": "UA-53",
      "name": "Poltava Oblast",
      "short_name": "Poltava",
      "source_name": "Poltavska",
      "source_shape_id": "82583831B11695179874863",
      "area_km2": 28628.3,
      "occupied_km2": 0,
      "free_km2": 28628.3,
      "occupied_share_pct": 0,
      "free_share_pct": 100,
      "status": "free"
    },
    {
      "region_id": "UA-56",
      "name": "Rivne Oblast",
      "short_name": "Rivne",
      "source_name": "Rivnenska",
      "source_shape_id": "82583831B61452359234308",
      "area_km2": 19980.7,
      "occupied_km2": 0,
      "free_km2": 19980.7,
      "occupied_share_pct": 0,
      "free_share_pct": 100,
      "status": "free"
    },
    {
      "region_id": "UA-59",
      "name": "Sumy Oblast",
      "short_name": "Sumy",